{"_type":"https://in-toto.io/Statement/v1","predicate":{"bundleKind":"run","complete":true,"contract":"keyed-v1","outcome":"PASS","parisonVersion":"0.1.0","policySha256":null,"schemaVersion":1,"sensitivity":"summary"},"predicateType":"https://parison.dev/attestations/evidence/v1","subject":[{"digest":{"sha256":"ea1812cd643b484a5f5509b4e47f79fff18ef00e90d332b021413a2daf9081ec"},"name":"manifest.json"}]}
